{
  "contract_groups": [
    {
      "artifact_name": "shortlist",
      "artifact_path": "data/processed/shortlist.json",
      "contract_group": "core_shortlist",
      "description": "Minimal discovery shortlist contract.",
      "docs_sync_notes": [],
      "extra_fields": [],
      "invalid_required_values": {},
      "missing_optional_fields": [
        "age_sec",
        "name",
        "pair_address",
        "txns_m5"
      ],
      "missing_required_fields": [],
      "optional_fields": [
        "age_sec",
        "liquidity_usd",
        "name",
        "pair_address",
        "symbol",
        "txns_m5"
      ],
      "present_any_fields": [
        "liquidity_usd",
        "symbol",
        "token_address"
      ],
      "present_fields": [
        "liquidity_usd",
        "symbol",
        "token_address"
      ],
      "required_fields": [
        "token_address"
      ],
      "row_count": 1,
      "status": "ok",
      "warnings": []
    },
    {
      "artifact_name": "x_validated",
      "artifact_path": "data/processed/x_validated.json",
      "contract_group": "core_x_validation",
      "description": "Minimal X-validation contract.",
      "docs_sync_notes": [],
      "extra_fields": [],
      "invalid_required_values": {},
      "missing_optional_fields": [
        "x_mentions_count",
        "x_validation_confidence",
        "x_validation_reason"
      ],
      "missing_required_fields": [],
      "optional_fields": [
        "x_mentions_count",
        "x_status",
        "x_validation_confidence",
        "x_validation_reason",
        "x_validation_score"
      ],
      "present_any_fields": [
        "token_address",
        "x_status",
        "x_validation_score"
      ],
      "present_fields": [
        "token_address",
        "x_status",
        "x_validation_score"
      ],
      "required_fields": [
        "token_address"
      ],
      "row_count": 1,
      "status": "ok",
      "warnings": []
    },
    {
      "artifact_name": "enriched_tokens",
      "artifact_path": "data/processed/enriched_tokens.json",
      "contract_group": "core_enriched",
      "description": "Core on-chain enrichment contract.",
      "docs_sync_notes": [],
      "extra_fields": [],
      "invalid_required_values": {},
      "missing_optional_fields": [],
      "missing_required_fields": [],
      "optional_fields": [
        "dev_sell_pressure_5m",
        "first50_holder_conc_est",
        "holder_entropy_est",
        "smart_wallet_hits",
        "top20_holder_share"
      ],
      "present_any_fields": [
        "bundle_composition_dominant",
        "bundle_count_first_60s",
        "bundle_evidence_confidence",
        "bundle_evidence_source",
        "bundle_evidence_status",
        "bundle_evidence_warning",
        "bundle_failure_retry_pattern",
        "bundle_metric_origin",
        "bundle_size_value",
        "bundle_success_rate",
        "bundle_timing_from_liquidity_add_min",
        "bundle_tip_efficiency",
        "bundle_wallet_clustering_score",
        "buyer_funder_overlap_count",
        "cluster_concentration_ratio",
        "cluster_dev_link_score",
        "cluster_evidence_confidence",
        "cluster_evidence_source",
        "cluster_evidence_status",
        "cluster_metric_origin",
        "cluster_sell_concentration_120s",
        "continuation_available_evidence",
        "continuation_confidence",
        "continuation_coverage_ratio",
        "continuation_inputs_status",
        "continuation_metric_origin",
        "continuation_missing_evidence",
        "continuation_status",
        "continuation_warning",
        "continuation_warnings",
        "contract_version",
        "creator_buyer_link_score",
        "creator_cluster_id",
        "creator_cluster_link_score",
        "creator_dev_link_score",
        "creator_funder_overlap_count",
        "creator_in_cluster_flag",
        "cross_block_bundle_correlation",
        "dev_buyer_link_score",
        "dev_sell_pressure_5m",
        "dominant_cluster_id",
        "enriched_at",
        "enrichment_status",
        "first50_holder_conc_est",
        "funder_overlap_count",
        "graph_cluster_coverage_ratio",
        "graph_cluster_id_count",
        "holder_entropy_est",
        "linkage_confidence",
        "linkage_metric_origin",
        "linkage_reason_codes",
        "linkage_risk_score",
        "linkage_status",
        "linkage_warning",
        "liquidity_refill_ratio_120s",
        "liquidity_shock_recovery_sec",
        "net_unique_buyers_60s",
        "num_unique_clusters_first_60s",
        "seller_reentry_ratio",
        "shared_funder_link_score",
        "smart_wallet_dispersion_score",
        "smart_wallet_hits",
        "token_address",
        "top20_holder_share",
        "unique_wallets_per_bundle_avg",
        "x_author_velocity_5m"
      ],
      "present_fields": [
        "bundle_composition_dominant",
        "bundle_count_first_60s",
        "bundle_evidence_confidence",
        "bundle_evidence_source",
        "bundle_evidence_status",
        "bundle_evidence_warning",
        "bundle_failure_retry_pattern",
        "bundle_metric_origin",
        "bundle_size_value",
        "bundle_success_rate",
        "bundle_timing_from_liquidity_add_min",
        "bundle_tip_efficiency",
        "bundle_wallet_clustering_score",
        "buyer_funder_overlap_count",
        "cluster_concentration_ratio",
        "cluster_dev_link_score",
        "cluster_evidence_confidence",
        "cluster_evidence_source",
        "cluster_evidence_status",
        "cluster_metric_origin",
        "cluster_sell_concentration_120s",
        "continuation_available_evidence",
        "continuation_confidence",
        "continuation_coverage_ratio",
        "continuation_inputs_status",
        "continuation_metric_origin",
        "continuation_missing_evidence",
        "continuation_status",
        "continuation_warning",
        "continuation_warnings",
        "contract_version",
        "creator_buyer_link_score",
        "creator_cluster_id",
        "creator_cluster_link_score",
        "creator_dev_link_score",
        "creator_funder_overlap_count",
        "creator_in_cluster_flag",
        "cross_block_bundle_correlation",
        "dev_buyer_link_score",
        "dev_sell_pressure_5m",
        "dominant_cluster_id",
        "enriched_at",
        "enrichment_status",
        "first50_holder_conc_est",
        "funder_overlap_count",
        "graph_cluster_coverage_ratio",
        "graph_cluster_id_count",
        "holder_entropy_est",
        "linkage_confidence",
        "linkage_metric_origin",
        "linkage_reason_codes",
        "linkage_risk_score",
        "linkage_status",
        "linkage_warning",
        "liquidity_refill_ratio_120s",
        "liquidity_shock_recovery_sec",
        "net_unique_buyers_60s",
        "num_unique_clusters_first_60s",
        "seller_reentry_ratio",
        "shared_funder_link_score",
        "smart_wallet_dispersion_score",
        "smart_wallet_hits",
        "token_address",
        "top20_holder_share",
        "unique_wallets_per_bundle_avg",
        "x_author_velocity_5m"
      ],
      "required_fields": [
        "contract_version",
        "enriched_at",
        "enrichment_status",
        "token_address"
      ],
      "row_count": 1,
      "status": "ok",
      "warnings": []
    },
    {
      "artifact_name": "enriched_tokens",
      "artifact_path": "data/processed/enriched_tokens.json",
      "contract_group": "bundle_cluster",
      "description": "Raw bundle and cluster metric fields carried on enriched-token rows.",
      "docs_sync_notes": [],
      "extra_fields": [],
      "invalid_required_values": {},
      "missing_optional_fields": [],
      "missing_required_fields": [],
      "optional_fields": [],
      "present_any_fields": [
        "bundle_composition_dominant",
        "bundle_count_first_60s",
        "bundle_evidence_confidence",
        "bundle_evidence_source",
        "bundle_evidence_status",
        "bundle_evidence_warning",
        "bundle_failure_retry_pattern",
        "bundle_metric_origin",
        "bundle_size_value",
        "bundle_success_rate",
        "bundle_timing_from_liquidity_add_min",
        "bundle_tip_efficiency",
        "bundle_wallet_clustering_score",
        "buyer_funder_overlap_count",
        "cluster_concentration_ratio",
        "cluster_dev_link_score",
        "cluster_evidence_confidence",
        "cluster_evidence_source",
        "cluster_evidence_status",
        "cluster_metric_origin",
        "cluster_sell_concentration_120s",
        "continuation_available_evidence",
        "continuation_confidence",
        "continuation_coverage_ratio",
        "continuation_inputs_status",
        "continuation_metric_origin",
        "continuation_missing_evidence",
        "continuation_status",
        "continuation_warning",
        "continuation_warnings",
        "contract_version",
        "creator_buyer_link_score",
        "creator_cluster_id",
        "creator_cluster_link_score",
        "creator_dev_link_score",
        "creator_funder_overlap_count",
        "creator_in_cluster_flag",
        "cross_block_bundle_correlation",
        "dev_buyer_link_score",
        "dev_sell_pressure_5m",
        "dominant_cluster_id",
        "enriched_at",
        "enrichment_status",
        "first50_holder_conc_est",
        "funder_overlap_count",
        "graph_cluster_coverage_ratio",
        "graph_cluster_id_count",
        "holder_entropy_est",
        "linkage_confidence",
        "linkage_metric_origin",
        "linkage_reason_codes",
        "linkage_risk_score",
        "linkage_status",
        "linkage_warning",
        "liquidity_refill_ratio_120s",
        "liquidity_shock_recovery_sec",
        "net_unique_buyers_60s",
        "num_unique_clusters_first_60s",
        "seller_reentry_ratio",
        "shared_funder_link_score",